 Juguete Goodbite Natural Cordero Comestible 1 unidad Ferplast - 70 Grs,3.69 €/u,https://www.petsonic.com/21426-large_default/juguete-goodbite-natural-cordero-comestible-4-unidades-ferplast.jpg
 Juguete Goodbite Natural Pollo Comestible 1 unidad Ferplast - 70 Grs,3.69 €/u,https://www.petsonic.com/21427-large_default/juguete-goodbite-natural-pollo-comestible-4-unidades-ferplast.jpg
 Juguete Goodbite Natural Cereal S 40Gr Comestible 1 unidad Ferplast - S,2.39 €/u,https://www.petsonic.com/21433-large_default/juguete-goodbite-natural-cereal-s-40gr-comestible-6-unidades-ferplast.jpg
 Juguete Goodbite Natural Cordero 40Grs 1 unidad Comestible Ferplast - XS,2.29 €/u,https://www.petsonic.com/21434-large_default/juguete-goodbite-natural-cordero-40grs-6-unidades-comestible-ferplast.jpg, Juguete Goodbite Natural Cordero 40Grs 1 unidad Comestible Ferplast - S,2.39 €/u,https://www.petsonic.com/21434-large_default/juguete-goodbite-natural-cordero-40grs-6-unidades-comestible-ferplast.jpg
 Juguete Goodbite Natural Jamon 1 Unidad Comestible Ferplast - S,2.39 €/u,https://www.petsonic.com/21438-large_default/juguete-goodbite-natural-jamon-6-unidades-comestible-ferplast.jpg
 Juguete Goodbite Natural Pollo 2 Unidades Comestible Ferplast - XS,2.29 €/u,https://www.petsonic.com/21440-large_default/juguete-goodbite-natural-pollo-6-unidades-comestible-ferplast.jpg
 Juguete Goodbite Natural Ternera 2 Unidades Comestible Ferplast - XS,2.29 €/u,https://www.petsonic.com/21442-large_default/juguete-goodbite-natural-ternera-6-unidades-comestible-ferplast.jpg, Juguete Goodbite Natural Ternera 2 Unidades Comestible Ferplast - S,2.39 €/u,https://www.petsonic.com/21442-large_default/juguete-goodbite-natural-ternera-6-unidades-comestible-ferplast.jpg
 Juguete Hueso Natural Cereal S 40Grs Comestible 6 unidades Ferplast - S,4.59 €/u,https://www.petsonic.com/21444-large_default/juguete-hueso-natural-cereal-s-40grs-comestible-6-unidades-ferplast.jpg
 Juguete Hueso Natural Cordero S 40Grs Comestible 6 unidades Ferplast - S,4.59 €/u,https://www.petsonic.com/21445-large_default/juguete-hueso-natural-cordero-s-40grs-comestible-6-unidades-ferplast.jpg
 Juguete Hueso Natural Jamon 40Grs 6 unidades Comestible 6 unidades Ferplast - XS,4.49 €/u,https://www.petsonic.com/21446-large_default/juguete-hueso-natural-jamon-40grs-6-unidades-comestible-6-unidades-ferplast.jpg, Juguete Hueso Natural Jamon 40Grs 6 unidades Comestible 6 unidades Ferplast - S,4.59 €/u,https://www.petsonic.com/21446-large_default/juguete-hueso-natural-jamon-40grs-6-unidades-comestible-6-unidades-ferplast.jpg
 Juguete Hueso Natural Pollo 40Grs 6 unidades Comestible 6 unidades Ferplast - XS,4.49 €/u,https://www.petsonic.com/21448-large_default/juguete-hueso-natural-pollo-40grs-6-unidades-comestible-6-unidades-ferplast.jpg, Juguete Hueso Natural Pollo 40Grs 6 unidades Comestible 6 unidades Ferplast - S,4.59 €/u,https://www.petsonic.com/21448-large_default/juguete-hueso-natural-pollo-40grs-6-unidades-comestible-6-unidades-ferplast.jpg
