 Alpha Spirit Complementos Snacks de Pollo en Monodosis para Perro - Pack 16 x 35Grs,10.25 €,https://www.petsonic.com/12024-large_default/snacks-de-pollo-en-monodosis-para-perro.jpg
 Alpha Spirit Complementos Snacks de Queso en Monodosis para Perro - Pack 16 x 35Grs,10.25 €,https://www.petsonic.com/12025-large_default/snacks-de-queso-en-monodosis-para-perro.jpg
 Alpha Spirit Complementos Snacks de Higado en Monodosis para Perro - Pack 16 x 35Grs,10.25 €,https://www.petsonic.com/12026-large_default/snacks-de-higado-en-monodosis-para-perro.jpg
 Alpha Spirit Complementos Snacks de Pescado en Monodosis para Perro - Pack 16 x 35Grs,10.25 €,https://www.petsonic.com/12027-large_default/snacks-de-pescado-en-monodosis-para-perro.jpg
 Alpha Spirit Complementos Snacks de Pato en Monodosis para Perro - Pack 16 x 35Grs,10.25 €,https://www.petsonic.com/12028-large_default/snacks-de-pato-en-monodosis-para-perro.jpg
 Kong Pasta Easy Treat para Perro - 0.236 L,5.82 €/u,https://www.petsonic.com/13278-large_default/kong-pasta-easy-treat-para-perros.jpg
 Purina Pro Plan Adventuros Mini Sticks de Búfalo - Pack 6 sobres de 90gr,7.00 €/u,https://www.petsonic.com/14127-large_default/purina-pro-plan-adventuros-mini-sticks-bufalo-para-perros.jpg
 Purina Pro Plan Adventuros Strips Venado - Pack 6 sobres de 90gr,7.00 €/u,https://www.petsonic.com/14128-large_default/purina-pro-plan-adventuros-strips-venado-para-perros.jpg
 Purina Pro Plan Adventuros Sticks de Búfalo - 120 gr,7.00 €/u,https://www.petsonic.com/14130-large_default/purina-pro-plan-adventuros-sticks-bufalo-para-perros.jpg, Purina Pro Plan Adventuros Sticks de Búfalo - 6 Unidades.,7.00 €/u,https://www.petsonic.com/14130-large_default/purina-pro-plan-adventuros-sticks-bufalo-para-perros.jpg
 Purina Pro Plan Biscuits Dental Bar 150gr. - 6 Unidades.,16.50 €,https://www.petsonic.com/13407-large_default/purina-pro-plan-biscuits-dental-bar-150gr-para-perros.jpg
 Purina Pro Plan Biscuits Light 400gr. - 4 Unidades,11.75 €/u,https://www.petsonic.com/13408-large_default/purina-pro-plan-biscuits-light-400gr-para-perros.jpg
 Acana Treat Free Run Duck 35 gr premios ultra calidad para perros - 1 Unidad.,6.17 €/u,https://www.petsonic.com/13837-large_default/treat-free-run-duck-35-gr.jpg
 Acana Treat Grass-Fed Lamb 35 gr premios ultra calidad para perros - 1 Unidad.,6.17 €/u,https://www.petsonic.com/13838-large_default/treat-grass-fed-lamb-35-gr.jpg
 Acana Treat Yorkshire Pork 35 gr premios ultra calidad para perros - 1 Unidad.,6.17 €/u,https://www.petsonic.com/13840-large_default/treat-yorkshire-pork-35-gr.jpg
 Orijen Free Run Duck dog treats premios para perro 100% proteina y nada mas - 42.5 Gr,7.19 €/u,https://www.petsonic.com/19383-large_default/orijen-treat-free-run-duck-42-5-gr-para-perros.jpg
 Orijen Regional dog Treats 42.5 gr premios para perro 100% proteina y nada mas - 1 Unidad.,6.17 €/u,https://www.petsonic.com/13414-large_default/regional-treats-42-5-gr.jpg, Orijen Regional dog Treats 42.5 gr premios para perro 100% proteina y nada mas - 6 Unidades.,33.30 €,https://www.petsonic.com/13414-large_default/regional-treats-42-5-gr.jpg
 Orijen Wild Boar dog treats premios para perro 100% proteina y nada mas - 42.5 Gr,5.96 €/u,https://www.petsonic.com/20625-large_default/orijen-treat-wild-board-56-gr-para-perros.jpg
 Orijen Original dog treats premios para perro 100% proteina y nada mas - 42.5 Gr,6.17 €/u,https://www.petsonic.com/9782-large_default/orijen-treats-original-56gr-para-perros.jpg
 Advance Puppy Snack premios para cachorros - Pack 7 sobres 150Grs.,20.55 €/u,https://www.petsonic.com/18854-large_default/affinity-advance-puppy-snack-para-perros.jpg
 Advance Dental Care Stick Mini Pack 4 x 360Grs higiene dental para perros - 28 Unidades,30.85 €,https://www.petsonic.com/18855-large_default/affinity-advance-dental-care-stick-mini-para-perros.jpg
 Advance Dental Care Stick Medium Pack higiene dental para perros - 180 Gr,35.29 €,https://www.petsonic.com/18858-large_default/affinity-advance-dental-care-stick-medium-para-perros.jpg, Advance Dental Care Stick Medium Pack higiene dental para perros - 13 Unidades.,35.29 €,https://www.petsonic.com/18858-large_default/affinity-advance-dental-care-stick-medium-para-perros.jpg
 Advance Hypoallergenic Snack premios para perros alergicos - Pack 7 sobres 150Grs.,18.53 €,https://www.petsonic.com/18860-large_default/affinity-advance-hypoallergenic-snack-para-perros.jpg
 Advance Appetite Control Snack para perros. Con efecto saciante - Pack 7 sobres 150Grs.,19.26 €,https://www.petsonic.com/18862-large_default/affinity-advance-appetite-control-snack-para-perros.jpg
 Advance Articular Snack premios condroprotectores para perro - 1 x 14 packs de 155 gr,38.51 €,https://www.petsonic.com/18859-large_default/affinity-advance-articular-snack-para-perros.jpg
 Advance Sensitive Snack premios para gatos sensibles cuidado intestinal - Pack 7 sobres 150Grs.,15.44 €/u,https://www.petsonic.com/18863-large_default/sensitive-snack.jpg
